{
  "task_id":"FIN-P18-WD-001",
  "phase":"P18",
  "workstream":"WD",
  "objective":"Implement deterministic immutable experiment tracking over canonical P18-C dataset manifests, recording hypotheses, parameters, code/model lineage and evaluation metrics without executing retraining or granting promotion authority.",
  "scope":[
    "Register immutable experiment specifications bound to one P18-C dataset manifest",
    "Record deterministic experiment runs and evaluation metrics supplied by controlled callers",
    "Require code, strategy and model lineage identifiers",
    "Canonicalize numeric parameters and metrics",
    "Prevent duplicate/conflicting experiment and run identities",
    "Maintain content-addressed experiment and run records",
    "Expose deterministic experiment registry snapshots",
    "Keep execution/retraining ownership in P18-E",
    "Generate deterministic offline P18-D evidence"
  ],
  "out_of_scope":[
    "Model training or retraining execution",
    "Champion/Challenger selection (P18-F)",
    "Drift/Strategy Decay (P18-G)",
    "Promotion Governance (P18-H)",
    "24/7 Loop Operations (P18-I)",
    "P19 work",
    "Broker/exchange routing or live execution",
    "Automatic live promotion"
  ],
  "dependencies":["P18-C CANONICAL_COMPLETE","P17-G Strategy Registry","P17-H Model Registry","P04 deterministic harness"],
  "read_paths":["packages/learning/**","config/**","docs/**","contracts/tasks/**",".github/workflows/governance.yml","scripts/ci/foundation_ci.py"],
  "write_paths":["contracts/tasks/FIN-P18-WD-001.json","config/learning/experiment-tracking-policy.json","packages/learning/__init__.py","packages/learning/experiments.py","tests/p18/test_experiment_tracking.py","scripts/ci/p18d_evidence.py","docs/12-learning/P18-D-EXPERIMENT-TRACKING.md","docs/12-learning/p18-d-experiment-tracking.json",".github/workflows/governance.yml","scripts/ci/foundation_ci.py","docs/01-roadmap/EXECUTION-ROADMAP.md","docs/02-current-state/CURRENT-STATE.md","docs/13-tasks/TASK-CATALOG.md"],
  "forbidden_paths":["docs/01-roadmap/MASTER-ROADMAP-v2.0.md","adapters/execution/**","packages/execution/**","secrets/**","credentials/**"],
  "agents":["A0","A4","A7","A9","A10"],
  "plugins":["GitHub","Linear"],
  "skills":[],
  "access":["REPO_READ","REPO_WRITE_GOVERNED","ACTIONS_READ","LINEAR_READ","LINEAR_WRITE_GOVERNED"],
  "secrets":[],
  "risk_level":"HIGH",
  "tests":[
    "Strict Pyright passes",
    "Experiment and run identities deterministic",
    "Duplicate/conflicting identities fail closed",
    "Dataset/model/strategy/code lineage required",
    "Metric and parameter canonicalization deterministic",
    "Registry snapshot deterministic",
    "No retraining, promotion, broker, live or auto authority",
    "P18-D evidence byte-identical across two runs"
  ],
  "security_tests":["No network or credential access","No training execution","No automatic live promotion","LIVE_TRADING/AUTO_TRADING remain disabled"],
  "evidence":["P18-C canonical closure","Deterministic P18-D evidence","Implementation Governance","Closure revalidation","Linear reconciliation"],
  "rollback":"Revert P18-D tracking/config/tests/evidence/CI/state changes; P18-C remains canonical and P18-E remains unstarted.",
  "human_gate":false,
  "definition_of_ready":["P18-C CANONICAL_COMPLETE","No active governed task or lock conflict"],
  "definition_of_done":["Deterministic immutable experiment tracking implemented","Strict CI and evidence pass","Implementation PR merged","Closure reconciliation merged","FIN-P18-WD-001 CANONICAL_COMPLETE","Lock released","P18-E becomes READY_NOT_STARTED","P19 remains NOT_STARTED"]
}
