{
  "task_id": "FIN-P12-WC-001",
  "phase": "P12",
  "workstream": "WC",
  "objective": "Implement deterministic regime-aware lead/lag analysis using exact timestamp-offset pairing, explicit ambiguity handling and P12-A observed-association evidence without causality or trade authority.",
  "scope": [
    "Evaluate governed symmetric lag steps using exact timestamp-offset pairing",
    "Use integer Pearson correlation on signed basis-point scale",
    "Emit LEFT_LEADS_RIGHT, RIGHT_LEADS_LEFT, CONTEMPORANEOUS or AMBIGUOUS",
    "Require explicit sampling interval, minimum sample count and nonzero variance",
    "Support optional canonical P08-G regime conditioning",
    "Handle equal-strength lag ties as AMBIGUOUS without directional graph edge",
    "Emit lag duration, sample count, correlation and sampling uncertainty metadata",
    "Emit P12-A OBSERVED_ASSOCIATION / UNATTRIBUTED edges for non-ambiguous results",
    "Preserve provenance SHA-256 and source dataset versions",
    "Support cross-asset and CIRA capital-flow nodes",
    "Generate deterministic offline P12-C evidence"
  ],
  "out_of_scope": [
    "Event studies (P12-D)",
    "Historical analog search (P12-E)",
    "Seasonality (P12-F)",
    "Causal attribution labels (P12-G)",
    "Replay/version validation (P12-H)",
    "Signal probability, risk approval and execution"
  ],
  "dependencies": [
    "P12-B CANONICAL_COMPLETE",
    "P12-B closure merge 364ee61b4ad0069eaec2ec113e880f0cca707579",
    "P12-B closure post-merge Governance 38136167076 SUCCESS",
    "P12-B closure Branch Hygiene 38136167083 SUCCESS",
    "Fresh Live Guard: active task none, active lock none, open PR none"
  ],
  "read_paths": [
    "config/market-memory/**",
    "packages/market_memory/**",
    "docs/**",
    ".github/workflows/governance.yml",
    "scripts/ci/foundation_ci.py"
  ],
  "write_paths": [
    "contracts/tasks/FIN-P12-WC-001.json",
    "config/market-memory/lead-lag-policy.json",
    "packages/market_memory/lead_lag.py",
    "packages/market_memory/__init__.py",
    "tests/p12/test_lead_lag.py",
    "scripts/ci/p12c_evidence.py",
    "docs/09-intelligence/P12-C-LEAD-LAG-ANALYSIS.md",
    "docs/09-intelligence/p12-c-lead-lag-analysis.json",
    ".github/workflows/governance.yml",
    "scripts/ci/foundation_ci.py",
    "docs/01-roadmap/EXECUTION-ROADMAP.md",
    "docs/02-current-state/CURRENT-STATE.md",
    "docs/13-tasks/TASK-CATALOG.md"
  ],
  "forbidden_paths": [
    "docs/01-roadmap/MASTER-ROADMAP-v2.0.md",
    "adapters/execution/**",
    "packages/execution/**",
    "secrets/**",
    "credentials/**",
    "infra/**"
  ],
  "agents": ["A0","A3","A4","A7","A10"],
  "plugins": ["GitHub","Linear"],
  "skills": [],
  "access": [
    "REPO_READ",
    "REPO_WRITE_GOVERNED",
    "ACTIONS_READ",
    "LINEAR_READ",
    "LINEAR_WRITE_GOVERNED"
  ],
  "secrets": [],
  "risk_level": "HIGH",
  "tests": [
    "Strict Pyright passes",
    "Known one-step left-leading fixture resolves LEFT_LEADS_RIGHT at +1",
    "Known one-step right-leading fixture resolves RIGHT_LEADS_LEFT at -1",
    "Contemporaneous fixture resolves lag 0",
    "Lag pairing uses exact timestamp offsets",
    "Insufficient sample and zero variance fail closed",
    "Duplicate timestamps fail closed",
    "Regime conditioning is deterministic",
    "Equal absolute-correlation ties resolve AMBIGUOUS with no directional edge",
    "Non-ambiguous graph edge remains OBSERVED_ASSOCIATION and UNATTRIBUTED",
    "Temporal precedence is never labelled causation",
    "P12-C evidence is byte-identical across two runs"
  ],
  "security_tests": [
    "No credentials/network required",
    "No execution imports",
    "LIVE_TRADING and AUTO_TRADING remain disabled"
  ],
  "evidence": [
    "P12-B canonical closure",
    "Deterministic P12-C lead-lag evidence",
    "Implementation Governance",
    "Post-merge Governance/Branch Hygiene",
    "Linear HOS-254 reconciliation"
  ],
  "rollback": "Revert P12-C policy/module/tests/evidence/CI/state changes; P12-B remains canonical.",
  "human_gate": false,
  "definition_of_ready": [
    "P12-B CANONICAL_COMPLETE",
    "No active task/lock/open PR conflict"
  ],
  "definition_of_done": [
    "Lead/lag analysis implemented",
    "Ambiguity fails closed",
    "Deterministic evidence and strict CI pass",
    "Implementation PR merged",
    "Post-merge Governance and Branch Hygiene pass",
    "Closure reconciliation merged",
    "FIN-P12-WC-001 CANONICAL_COMPLETE",
    "Lock released",
    "Linear HOS-254 Done",
    "P12-D READY_NOT_STARTED"
  ]
}
