{
  "task_id": "FIN-P14-WD-001",
  "phase": "P14",
  "workstream": "WD",
  "objective": "Implement deterministic statistical and regime-context uncertainty qualification around canonical P14-C calibrated probabilities while preserving the empirical probability unchanged.",
  "scope": [
    "Consume canonical P14-C CalibratedProbability outputs",
    "Compute deterministic 95% Wilson score confidence intervals from success_count/sample_count",
    "Expose governed sample-support state without modifying empirical probability",
    "Consume explicit versioned/provenanced regime-similarity evidence",
    "Preserve regime similarity as evidence rather than probability",
    "Compute conservative overall uncertainty as the maximum of confidence-interval half-width, regime dissimilarity and regime-evidence uncertainty",
    "Expose dominant uncertainty sources and deterministic qualification identity",
    "Return explicit maximum uncertainty for insufficient P14-C calibration data",
    "Generate deterministic offline P14-D evidence"
  ],
  "out_of_scope": [
    "TP/Stop outcome probabilities (P14-E)",
    "Persian explainability (P14-F)",
    "Independent Red-Team challenge (P14-G)",
    "Signal output contract (P14-H)",
    "G7 validation (P14-I)",
    "Portfolio risk, position sizing, risk approval or execution"
  ],
  "dependencies": [
    "P14-C CANONICAL_COMPLETE",
    "P14-C closure merge 53e359a4b93f21762e98ce1d7ead503f04d68d3d",
    "P14-C closure post-merge Governance 38401770675 SUCCESS",
    "P14-C closure Branch Hygiene 38401771643 SUCCESS",
    "Fresh Live Guard: open PR none, active task none, active lock none"
  ],
  "read_paths": [
    "packages/signal_intelligence/**",
    "packages/market_memory/historical_analog.py",
    "packages/technical_intelligence/multi_timeframe_regime.py",
    "docs/**",
    ".github/workflows/governance.yml",
    "scripts/ci/foundation_ci.py"
  ],
  "write_paths": [
    "contracts/tasks/FIN-P14-WD-001.json",
    "config/signal-intelligence/probability-uncertainty-policy.json",
    "packages/signal_intelligence/__init__.py",
    "packages/signal_intelligence/probability_uncertainty.py",
    "tests/p14/test_probability_uncertainty.py",
    "scripts/ci/p14d_evidence.py",
    "docs/09-intelligence/P14-D-PROBABILITY-UNCERTAINTY.md",
    "docs/09-intelligence/p14-d-probability-uncertainty.json",
    ".github/workflows/governance.yml",
    "scripts/ci/foundation_ci.py",
    "docs/01-roadmap/EXECUTION-ROADMAP.md",
    "docs/02-current-state/CURRENT-STATE.md",
    "docs/13-tasks/TASK-CATALOG.md"
  ],
  "forbidden_paths": [
    "docs/01-roadmap/MASTER-ROADMAP-v2.0.md",
    "packages/execution/**",
    "packages/risk/**",
    "secrets/**",
    "credentials/**",
    "infra/**"
  ],
  "agents": [
    "A0",
    "A3",
    "A4",
    "A5",
    "A10"
  ],
  "plugins": [
    "GitHub",
    "Linear"
  ],
  "skills": [],
  "access": [
    "REPO_READ",
    "REPO_WRITE_GOVERNED",
    "ACTIONS_READ",
    "LINEAR_READ",
    "LINEAR_WRITE_GOVERNED"
  ],
  "secrets": [],
  "risk_level": "HIGH",
  "tests": [
    "Strict Pyright passes",
    "P14-C empirical probability is preserved exactly",
    "95% Wilson interval contains the empirical probability",
    "Higher sample count with same empirical rate narrows the interval",
    "Sample-support states are deterministic",
    "Regime dissimilarity and regime-evidence uncertainty are explicit",
    "Overall uncertainty equals the maximum governed uncertainty component",
    "Dominant uncertainty sources are deterministic",
    "Prediction/regime identity or as-of mismatch fails closed",
    "Invalid similarity/uncertainty scales fail closed",
    "Insufficient P14-C calibration returns explicit maximum uncertainty without inventing probability",
    "Regime similarity is never exposed as probability",
    "LLM probability/uncertainty authority remains forbidden",
    "P14-D evidence is byte-identical across two runs"
  ],
  "security_tests": [
    "No network/credentials required",
    "No empirical probability mutation",
    "No risk/sizing/execution authority",
    "LIVE_TRADING and AUTO_TRADING remain disabled"
  ],
  "evidence": [
    "P14-C canonical closure",
    "P12 historical-analog similarity semantics",
    "Deterministic P14-D uncertainty evidence",
    "Implementation Governance",
    "Post-merge Governance and Branch Hygiene",
    "Linear HOS-272 reconciliation"
  ],
  "rollback": "Revert P14-D policy/module/tests/evidence/CI/state changes; P14-C remains canonical and P14-E remains unstarted.",
  "human_gate": false,
  "definition_of_ready": [
    "P14-C CANONICAL_COMPLETE",
    "No active task/lock/open PR conflict"
  ],
  "definition_of_done": [
    "Wilson confidence interval and sample-support qualification implemented",
    "Governed regime-similarity evidence integrated without probability semantics",
    "Conservative overall uncertainty implemented",
    "P14-C empirical probability remains immutable",
    "Deterministic evidence and strict CI pass",
    "Implementation PR merged",
    "Post-merge Governance and Branch Hygiene pass",
    "Closure reconciliation merged",
    "FIN-P14-WD-001 CANONICAL_COMPLETE",
    "Lock released",
    "Linear HOS-272 Done",
    "P14-E READY_NOT_STARTED"
  ]
}
